game,console,Publisher,Release Year,Release Month,Release Day,Total Shipped,NA Sales,PAL Sales,Japan Sales,Other Sales,NS,PS4,XBOX ONE,PC,Genre(s),VGChartz Score,Metacritic(Critic),Metacritic(User),4Players,Destructoid,Edge,EGM,Game Informer,GameRevolution,GameSpot,GamesRadar+,IGN,Famitsu,Famitsu*5/2,Introduction
Until Dawn,PS4,Sony Computer Entertainment	,2015,8,25,1900000,620000,920000,60000,300000,0,1,0,0,"Action Adventure, Horror, Survival, Third-Person",N/A,79,83,80,70,N/A,80,90,80,80,70,75,N/A,#VALUE!,"Until Dawn is a 2015 interactive drama horror video game developed by Supermassive Games and published by Sony Computer Entertainment for the PlayStation 4. Players assume control of eight young adults who have to survive on Blackwood Mountain when their lives are threatened. The game features a hyperlink cinema-esque for its multilinear narratives and butterfly effect system in which players must make choices that may change the story. All playable characters can survive or die, depending on the choices made. Players explore the environment from a third-person perspective and find clues that may help solve the mystery."
The Evil Within,PS4,Bethesda Softworks,2014,10,14,1860000,560000,900000,110000,280000,0,1,1,1,"Horror, Action Adventure, Survival",77,75,76,76,70,N/A,N/A,90,N/A,70,70,87,35,87.5,"The Evil Within is a third-person survival horror video game developed by Tango Gameworks and published by Bethesda Softworks. The game was directed by Resident Evil series creator Shinji Mikami and was released worldwide in October 2014 for PlayStation 3, PlayStation 4, Windows, Xbox 360, and Xbox One."
Kingdom Hearts HD I.5 + II.5 ReMIX,PS4,Square Enix,2017,3,28,1800000,N/A,N/A,N/A,N/A,0,1,1,1,"Miscellaneous, Compilation, Role-Playing, Action RPG",N/A,84,89,N/A,N/A,N/A,N/A,N/A,N/A,N/A,N/A,N/A,N/A,#VALUE!,"Kingdom Hearts HD 2.5 Remix includes Kingdom Hearts II Final Mix and Kingdom Hearts Birth by Sleep Final Mix in high definition and with trophy support. Additionally, the collection features a cinematic remake of Kingdom Hearts Re:coded that features remastered cutscenes from the original game as well as new content. A third collection, Kingdom Hearts HD 2.8 Final Chapter Prologue, was released in 2017. 2.5 Remix was re-released along with 1.5 Remix on the PlayStation 4 in March 2017. "
The Crew,PS4,Ubisoft,2014,12,2,1790000,440000,1040000,30000,270000,0,1,1,1,"Driving, Racing, Simulation, Automobile",N/A,61,53,73,75,N/A,60,70,60,50,70,60,N/A,#VALUE!,"The Crew is an online-only racing video game developed by Ivory Tower and Ubisoft Reflections and published by Ubisoft for Microsoft Windows, PlayStation 4 and Xbox One, with an Xbox 360 port developed by Asobo Studio. It features a persistent open world environment for free-roaming across a scaled-down recreation of the United States and includes both role-playing and large-scale multiplayer elements. "
For Honor,PS4,Ubisoft,2017,2,14,1750000,730000,660000,70000,280000,0,1,1,1,"Action Adventure, General",N/A,78,61,81,55,N/A,70,82.5,80,80,80,80,N/A,#VALUE!,"For Honor is a 2017 action video game developed and published by Ubisoft for Microsoft Windows, PlayStation 4, and Xbox One. The game allows players to play the roles of historical forms of soldiers and warriors, including knights, samurai, vikings and since October 2018 the Chinese Wu Lin, within a medieval setting, controlled using a third-person perspective. The game was developed primarily by Ubisoft Montreal and released worldwide in 2017. "
Shadow of the Tomb Raider,PS4,Square Enix	,2018,9,14,1740000,590000,820000,60000,270000,0,1,1,1,"Action Adventure, General",N/A,75,73,80,75,N/A,80,N/A,80,60,80,90,N/A,#VALUE!,"Shadow of the Tomb Raider is a 2018 action-adventure video game developed by Eidos-Montréal and published by Square Enix's European subsidiary. It continues the narrative from the 2015 game Rise of the Tomb Raider and is the twelfth mainline entry in the Tomb Raider series. The game was originally released worldwide for Microsoft Windows, PlayStation 4 and Xbox One. Versions for macOS and Linux, and Stadia, were released in November 2019. After release, the game was expanded upon with downloadable content in both a season pass and as standalone releases. "
Titanfall 2,PS4,Electronic Arts        ,2016,10,28,1720000,750000,620000,60000,280000,0,1,1,1,"Action, Shooter, First-Person, Arcade",89,89,85,87,85,N/A,N/A,95,80,90,90,90,N/A,#VALUE!,"Titanfall 2 is a first-person shooter video game, developed by Respawn Entertainment and published by Electronic Arts. A sequel to 2014's Titanfall, the game was released worldwide on October 28, 2016, for Windows, PlayStation 4, and Xbox One. In Titanfall 2, players control Titans, mecha-style exoskeletons and their pilots, who are agile and equipped with a variety of skills ranging from wall-running to cloaking. Set in a science fiction universe, the single-player campaign follows the story of Jack Cooper, a rifleman from the Frontier Militia, who bonds with his mentor's Titan BT-7274 after his mentor is killed in action. Together, they embark on a quest to stop the Interstellar Manufacturing Corporation (IMC) from launching a superweapon that is threatening to destroy the Militia planet Harmony. "
Injustice 2,PS4,Warner Bros. Interactive Entertainment	,2017,5,16,1720000,880000,540000,N/A,290000,0,1,1,1,"Action, Fighting",N/A,87,80,86,90,N/A,N/A,90,60,90,N/A,90,N/A,#VALUE!,"Injustice 2 is a 2017 fighting video game based upon the DC Universe. It is developed by NetherRealm Studios and published by Warner Bros. Interactive Entertainment. It is the sequel to 2013's Injustice: Gods Among Us. The game was initially released in May 2017 for the PlayStation 4 and Xbox One; a Microsoft Windows version was released later in November 2017. An expanded version of the game, titled Injustice 2: Legendary Edition, was released in March 2018 for the PlayStation 4, Xbox One, and Microsoft Windows. Similar to the previous installment, a companion mobile app was released for Android and iOS devices. A prequel comic book series of the same name, written by Tom Taylor, was also released beginning in April 2017. "
Persona 5,PS4,Atlus,2017,4,4,1640000,620000,340000,480000,200000,0,1,0,0,"Role-Playing, Japanese-Style",N/A,93,87,91,90,80,80,92.5,100,90,100,97,39,97.5,"Persona 5 is a 2016 role-playing video game developed by Atlus. It is the sixth installment in the Persona series, which is part of the larger Megami Tensei franchise. It was released for the PlayStation 3 and PlayStation 4 in Japan in September 2016 and worldwide in April 2017, and was published by Atlus in Japan and North America and by Deep Silver in Europe and Australia. An enhanced version featuring new content, Persona 5 Royal,was released for the PlayStation 4 in Japan in October 2019 and worldwide in March 2020. "
The Order: 1886,PS4,Sony Computer Entertainment	,2015,2,20,1620000,440000,860000,70000,250000,0,1,0,0,"General, Action, Action Adventure, Shooter, Linear, Third-Person, Arcade",62,63,67,59,60,N/A,45,77.5,40,50,50,65,N/A,#VALUE!,"The Order: 1886 is a 2015 third-person action-adventure video game developed by Ready at Dawn and Santa Monica Studio and published by Sony Computer Entertainment. It was released for the PlayStation 4 on February 20, 2015. Set in an 1886 alternate history steampunk London, the game follows the legendary Knights of the Round Table as they battle to keep the world safe from half-breeds, such as werewolves and vampires, as well as fringe organizations rebelling against the government. "
Wolfenstein: The New Order,PS4,Bethesda Softworks,2014,5,20,1610000,480000,840000,30000,250000,0,1,1,1,"General, Historic, Action, Shooter, First-Person, Arcade",N/A,79,80,68,75,N/A,N/A,80,N/A,80,80,78,N/A,#VALUE!,"Wolfenstein: The New Order is a 2014 action-adventure first-person shooter video game developed by MachineGames and published by Bethesda Softworks. It was released on 20 May 2014 for Microsoft Windows, PlayStation 3, PlayStation 4, Xbox 360, and Xbox One. The game is the seventh main entry in the Wolfenstein series and the successor to 2009's Wolfenstein, set in an alternate history 1960s Europe where the Nazis won the Second World War. The story follows war veteran William ""B.J."" Blazkowicz and his efforts to stop the Nazis from ruling over the world. "
NBA 2K14,PS4,2K Sports,2013,11,15,1540000,910000,350000,10000,270000,0,1,1,1,"Arcade, Sports, Basketball",N/A,85,65,88,N/A,N/A,N/A,N/A,N/A,N/A,N/A,93,N/A,#VALUE!,"NBA 2K14 is a basketball video game developed by Visual Concepts and published by 2K Sports. The fifteenth installment in the series, it was released on October 1, 2013, for Microsoft Windows, PlayStation 3, and Xbox 360,and the PlayStation 4 and the Xbox One versions were released on the consoles' respective launch dates. LeBron James of the Miami Heat became the cover athlete,and also served as the music curator for the game. 2K Sports also released the DLC pack that as a bonus for pre-ordering the game, they would receive 10,000 VC, bonus content for ""Path to Greatness"" mode, adding James in the Blacktop mode and a signature skill for MyCareer mode.[4] On August 14, 2013, 2K Sports announced that Crew Mode would return to this year's installment of NBA 2K. NBA 2K14 is the successor to NBA 2K13 and was succeeded by NBA 2K15 in the NBA 2K series. "
Tomb Raider: Definitive Edition,PS4,Square Enix,2014,1,28,1510000,470000,740000,60000,230000,0,1,1,1,"Modern, Action Adventure, General, Linear",N/A,85,81,N/A,N/A,N/A,N/A,92.5,N/A,85,90,91,38,95,"Tomb Raider is a 2013 action-adventure video game developed by Crystal Dynamics and published by Square Enix's European subsidiary. It is the tenth title in the Tomb Raider franchise, and operates as a reboot that reconstructs the origins of Lara Croft.Tomb Raider was first released on 5 March 2013 for Microsoft Windows, PlayStation 3 and Xbox 360, and later on 23 January 2014 for OS X, on 27 April 2016 for Linux,on 7 March 2017 for Shield TV,and on 19 November 2019 on Stadia. "
Rayman Legends,PS4,Ubisoft,2014,2,18,1500000,220000,1050000,N/A,230000,1,1,1,1,"Action, Platformer",N/A,90,84,N/A,N/A,90,N/A,N/A,N/A,90,90,95,N/A,#VALUE!,"Rayman Legends is a platform video game developed by Ubisoft Montpellier and published by Ubisoft. It is the fifth main title in the Rayman series and the direct sequel to the 2011 game Rayman Origins. The game was released for Microsoft Windows, PlayStation 3, Xbox 360, Wii U, and PlayStation Vita platforms in August and September 2013. PlayStation 4 and Xbox One versions were released in February 2014, with a Stadia Xbox Series X and PlayStation 5 version coming later in 2021. A Nintendo Switch port, titled Rayman Legends Definitive Edition was released in North America, Europe and Australia on September 12, 2017"
Mass Effect: Andromeda,PS4,Electronic Arts	,2017,3,21,1490000,580000,670000,N/A,250000,0,1,1,1,"Role-Playing, Action RPG",N/A,71,49,78,65,N/A,60,80,70,60,70,77,N/A,#VALUE!,"Mass Effect: Andromeda is an action role-playing video game developed by BioWare and published by Electronic Arts. The fourth major entry in the Mass Effect series, it was released in March 2017 for Microsoft Windows, PlayStation 4, and Xbox One. The game is set within the Andromeda Galaxy during the 29th century, where humanity is planning to populate new home worlds as part of a strategy called the Andromeda Initiative. The player assumes the role of either Scott or Sara Ryder, an inexperienced military recruit who joins the Initiative and wakes up in Andromeda following a 634-year sleeper ship journey. Events transpire that result in Ryder becoming humanity's Pathfinder, who is tasked with finding a new home world for humanity while also dealing with an antagonistic alien species known as the Kett, and uncovering the secrets of a mysterious synthetic intelligence species known as the Remnant. "
South Park: The Fractured But Whole,PS4,Ubisoft,2017,10,17,1430000,620000,570000,N/A,240000,1,1,1,1,"Role-Playing, General",N/A,79,77,84,85,N/A,90,87.5,70,80,90,85,N/A,#VALUE!,"South Park: The Fractured but Whole is a 2017 role-playing video game developed by Ubisoft San Francisco and published by Ubisoft in collaboration with South Park Digital Studios. Based on the American adult animated television series South Park, it is the sequel to the 2014 video game South Park: The Stick of Truth. The game's narrative occurs one day after the events of its predecessor; it follows the New Kid, who has recently moved to South Park and becomes involved in an epic roleplay involving two rival superhero factions vying to create their own superhero media franchises. The superheroes' game unintentionally uncovers a conspiracy to raise crime in the town, bringing them into conflict with supervillains, genetically engineered monsters, the police, crime families, and the new kingpin of crime. "
Nioh 2,PS4,Sony Interactive Entertainment	,2020,3,13,1400000,N/A,N/A,N/A,N/A,0,1,0,1,"Role-Playing, Action RPG",N/A,85,79,85,90,N/A,80,85,90,80,90,90,N/A,#VALUE!,"Nioh 2  is an action role-playing game developed by Team Ninja and Kou Shibusawa. Both prequel and sequel to Nioh (2017), the game was released for the PlayStation 4 on March 13, 2020, where it was published by Koei Tecmo in Japan and Sony Interactive Entertainment worldwide. Versions for Microsoft Windows and PlayStation 5 titled Nioh 2: Complete Edition featuring all the previous downloadable content were released on February 5, 2021. "
Persona 5 Royal,PS4,Atlus,2020,3,31,1400000,N/A,N/A,N/A,N/A,0,1,0,0,"Role-Playing, Japanese-Style",90,95,84,92,90,80,80,92.5,100,100,100,100,37,92.5,"Persona 5 is a 2016 role-playing video game developed by Atlus. It is the sixth installment in the Persona series, which is part of the larger Megami Tensei franchise. It was released for the PlayStation 3 and PlayStation 4 in Japan in September 2016 and worldwide in April 2017, and was published by Atlus in Japan and North America and by Deep Silver in Europe and Australia. An enhanced version featuring new content, Persona 5 Royal, was released for the PlayStation 4 in Japan in October 2019 and worldwide in March 2020. "
The Sims 4,PS4,Electronic Arts	,2017,11,17,1390000,440000,720000,10000,220000,0,1,1,1,"Simulation, Virtual, Virtual Life",N/A,66,38,65,N/A,N/A,N/A,67.5,70,60,60,75,N/A,#VALUE!,"The Sims 4 is a 2014 life simulation video game developed by the Redwood Shores studio of Maxis and published by Electronic Arts. It is the fourth major title in The Sims series and was originally announced on May 6, 2013. It was released in North America on September 2, 2014, for Microsoft Windows.A Mac-compatible version of the game was released on February 17, 2015. The Sims 4 is the first PC game to top all-format charts in two years. The game has received mixed reviews since its release, with the majority of criticism directed towards its lack of content."
Street Fighter V,PS4,Capcom,2016,2,16,1390000,640000,420000,120000,220000,0,1,0,1,"Action, Fighting",N/A,77,36,86,80,70,80,72.5,80,70,90,80,35,87.5,"Street Fighter V is a fighting game developed by Capcom and Dimps and published by Capcom for the PlayStation 4 and Microsoft Windows in 2016. The game was initially announced for Linux, but this version was never released"
Wolfenstein II: The New Colossus,PS4,Bethesda Softworks,2017,10,27,1360000,550000,580000,10000,220000,1,1,1,1,"Action, Shooter, First-Person, Arcade",90,87,73,86,80,70,80,97.5,80,N/A,90,91,N/A,#VALUE!,"Wolfenstein II: The New Colossus is a 2017 action-adventure first-person shooter video game developed by MachineGames and published by Bethesda Softworks. It was released on 27 October 2017 for Microsoft Windows, PlayStation 4, and Xbox One, and was released on 29 June 2018 for Nintendo Switch. The eighth main entry in the Wolfenstein series and the sequel to 2014's Wolfenstein: The New Order, the game is set in an alternate history which takes place in 1961 following the Nazi victory in the Second World War. The story follows war veteran William ""B.J."" Blazkowicz and his efforts to fight against the Nazi regime in the United States. "
WWE 2K18,PS4,2K Sports,2017,10,17,1330000,450000,670000,N/A,220000,1,1,1,1,"Sports, Individual, Combat, Wrestling",N/A,66,55,67,50,N/A,N/A,60,N/A,50,80,38,N/A,#VALUE!,"WWE 2K18 is a professional wrestling video game developed by Yuke's and published by 2K Sports. It is the nineteenth installment in the WWE game series (fifth under the WWE 2K banner) and a follow-up to WWE 2K17. It was released worldwide on October 17, 2017 for Microsoft Windows, PlayStation 4, Xbox One and Nintendo Switch. With its release, WWE 2K18 became the first in the series to be exclusively released on eighth generation hardware and also the first in the series to be released for PC and consoles simultaneously. A Nintendo Switch version followed on December 6, 2017, the only release of the series for the Switch and the first WWE game to be released for a Nintendo platform since WWE '13."
Fallout 76,PS4,Bethesda Softworks,2018,11,14,1320000,520000,490000,100000,200000,0,1,1,1,"Role-Playing, Western-Style",51,53,28,39,N/A,N/A,N/A,60,N/A,40,50,50,N/A,#VALUE!,"Fallout 76 is an online action role-playing game developed by Bethesda Game Studios and published by Bethesda Softworks. Released for Microsoft Windows, PlayStation 4, and Xbox One on November 14, 2018, it is an installment in the Fallout series and a prequel to previous entries. Fallout 76 is Bethesda Game Studios's first multiplayer game; players explore the open world, which has been torn apart by nuclear war, with others. Bethesda developed the game using a modified version of its Creation Engine, which allowed the accommodation of multiplayer gameplay and a more detailed game world than in previous games. "
Lego Star Wars: The Force Awakens,PS4,Warner Bros. Interactive Entertainment,2016,6,28,1310000,300000,780000,20000,200000,0,1,1,1,"Action Adventure, General",N/A,78,74,83,70,N/A,N/A,85,N/A,70,N/A,90,N/A,#VALUE!,"Lego Star Wars: The Force Awakens is a Lego-themed action-adventure video game developed by TT Fusion, based on the 2015 film Star Wars: The Force Awakens. It is the fifth entry in TT Games' Lego Star Wars series of video games. Under license from Lucasfilm, the game was released by Warner Bros. Interactive Entertainment for iOS, Microsoft Windows, PlayStation 3, PlayStation 4, Xbox 360, Xbox One, Nintendo 3DS, PlayStation Vita, and Wii U, on 28 June 2016, and for Android on 27 July 2016. The game was ported and released by Feral Interactive for OS X on 30 June 2016. "
EA Sports UFC 2,PS4,EA Sports,2016,3,15,1310000,440000,650000,N/A,210000,0,1,1,0,"Sports, General, Individual, Combat",N/A,79,58,84,N/A,N/A,70,85,80,70,60,64,N/A,#VALUE!,"EA Sports UFC 2 is a mixed martial arts fighting video game developed by EA Canada, and published in March 2016 by Electronic Arts for PlayStation 4 and Xbox One. The sequel to 2014's EA Sports UFC, it is based on the Ultimate Fighting Championship (UFC) brand. The game's cover art features Ronda Rousey and Conor McGregor. "
Kingdom Hearts HD II.8 Final Chapter Prologue,PS4,Square Enix,2017,1,24,1300000,N/A,N/A,N/A,N/A,0,1,1,1,"Miscellaneous, Compilation, Role-Playing, Action RPG",76,76,81,N/A,75,N/A,N/A,85,N/A,70,80,75,34,85,"Kingdom Hearts HD 2.8 Final Chapter Prologue[a] is a compilation of games from the Kingdom Hearts series, developed and published by Square Enix. A successor to the Kingdom Hearts HD 2.5 Remix game compilation, the new title was announced in September 2015 and released in January 2017 on PlayStation 4, February 2020 on Xbox One and March 2021 on Microsoft Windows. "
The Last Guardian,PS4,Sony Interactive Entertainment,2016,12,6,1290000,400000,580000,130000,190000,0,1,0,0,"Fantasy, Action Adventure, Linear",79,82,79,91,85,90,75,80,70,90,90,70,38,95,"The Last Guardian is a 2016 action-adventure game developed by Japan Studio and GenDesign. and published by Sony Interactive Entertainment for the PlayStation 4. Players control a boy who befriends a giant half-bird, half-mammal creature, Trico. "
WWE 2K16,PS4,Take-Two Interactive,2015,10,27,1290000,430000,650000,N/A,210000,0,1,1,1,"Sports, Individual, Combat, Wrestling",N/A,73,72,79,N/A,N/A,80,62.5,80,40,80,88,N/A,#VALUE!,"WWE 2K16 is a professional wrestling video game developed by Yuke's and published by 2K Sports for Microsoft Windows, PlayStation 3, PlayStation 4, Xbox 360 and Xbox One. It is the sequel to WWE 2K15, and was succeeded by WWE 2K17. It was released on October 27, 2015, in North America and on October 30, 2015, in Europe, while being released on PC on March 11, 2016."
Borderlands: The Handsome Collection,PS4,2K Games,2015,3,24,1280000,690000,340000,30000,220000,1,1,1,1,"Miscellaneous, Compilation",N/A,82,78,N/A,N/A,N/A,N/A,N/A,N/A,N/A,80,84,N/A,#VALUE!,"Borderlands: The Handsome Collection (released as Borderlands: The Legendary Collection on Nintendo Switch) is a compilation of first-person shooter video games developed by Gearbox Software and published by 2K Games. The Handsome Collection consists of both Borderlands 2 and Borderlands: The Pre-Sequel for PlayStation 4 and Xbox One, along with all of their accompanying downloadable content, enhanced local multiplayer, and the ability to transfer save data from their respective PlayStation 3 (Both Borderlands 2 & Pre-Sequel)/Vita/PSVR and Xbox 360 versions. A port to the Nintendo Switch entitled The Legendary Collection was released in North America on May 29, 2020, which additionally includes the first Borderlands. For The Handsome Collection, Borderlands 2 was ported by Iron Galaxy Studios and Borderlands: The Pre-Sequel by Armature Studio."
Project CARS,PS4,Bandai Namco Games,2015,5,12,1280000,290000,760000,40000,190000,0,1,1,1,"Driving, Racing, Simulation, General, Automobile",N/A,83,66,86,70,N/A,70,85,N/A,80,70,89,N/A,#VALUE!,"Project CARS is a motorsport racing simulator video game developed by Slightly Mad Studios and published and distributed by Bandai Namco Entertainment. It was released in May 2015 for Microsoft Windows, PlayStation 4, and Xbox One. "
WWE 2K17,PS4,2K Games,2016,10,11,1220000,320000,700000,N/A,190000,0,1,1,1,"Sports, Individual, Combat, Wrestling",N/A,69,60,70,N/A,N/A,60,57.5,N/A,60,80,82,N/A,#VALUE!,"WWE 2K17 is a professional wrestling video game developed by Yuke's and published by 2K Sports for PlayStation 3, PlayStation 4, Xbox 360, Xbox One, and Microsoft Windows. It is the eighteenth game in the WWE game series (fourth under the WWE 2K banner), serving as the following from their previous game WWE 2K16 (released in 2015), and followed by WWE 2K18 (released in 2017). This is the fourth and final installment released for the PlayStation 3 and Xbox 360 platforms and on those platforms still follows the gameplay blueprint of WWE 2K14."
Guitar Hero Live,PS4,Activision,2015,10,20,1210000,520000,490000,N/A,200000,0,1,1,1,"Action, Rhythm, Music",N/A,80,62,78,95,N/A,N/A,75,70,60,70,79,N/A,#VALUE!,"Guitar Hero Live is a 2015 music rhythm video game developed by FreeStyleGames and published by Activision. It is the seventh main installment in the Guitar Hero series. The game was released for PlayStation 3, PlayStation 4, Wii U, Xbox 360, and Xbox One in November 2015. As with previous games in the series, the goal is to use a special guitar controller to match fret patterns displayed on a scrolling note pattern on screen in time with the music. "
Metal Gear Solid V: Ground Zeroes,PS4,Konami Digital Entertainment,2014,3,18,1200000,360000,500000,170000,170000,0,1,1,1,"Action Adventure, General, Modern, Open-World",76,75,64,76,N/A,N/A,50,70,N/A,80,N/A,80,N/A,#VALUE!,"Metal Gear Solid V: Ground Zeroes is a stealth game developed by Kojima Productions and published by Konami. It was released for PlayStation 3, PlayStation 4, Xbox 360 and Xbox One in March 2014, and for Microsoft Windows in December 2014. It is the eighth game in the Metal Gear series directed, written and designed by Hideo Kojima, and serves as a prologue to Metal Gear Solid V: The Phantom Pain, released the following year."
Mad Max (2013),PS4,Warner Bros. Interactive Entertainment	,2015,9,1,1200000,380000,590000,50000,190000,0,1,1,1,"General, Action, Action Adventure, Open-World",N/A,69,78,76,70,N/A,N/A,75,N/A,60,80,84,N/A,#VALUE!,"Mad Max is an action-adventure video game based on the Mad Max franchise. Developed by Avalanche Studios and published by Warner Bros. Interactive Entertainment, it was released for Microsoft Windows, PlayStation 4, and Xbox One in 2015. Feral Interactive published the game's macOS and Linux versions. In the game, players control Max Rockatansky as he progresses through the wasteland building a vehicle, the ""Magnum Opus"", to do battle with a gang of raiders, led by Scabrous Scrotus, and to reach the storied ""Plains of Silence"", where he hopes to find peace. Mad Max emphasizes vehicular combat, in which players can use weapon and armor upgrades on their car to fight enemies. It is set in an open post-apocalyptic wasteland consisting of deserts, canyons, and caves. "
