game,console,Publisher,Release Year,Release Month,Release Day,Total Shipped,NA Sales,PAL Sales,Japan Sales,Other Sales,NS,PS4,XBOX ONE,PC,Genre(s),VGChartz Score,Metacritic(Critic),Metacritic(User),4Players,Destructoid,Edge,EGM,Game Informer,GameRevolution,GameSpot,GamesRadar+,IGN,Famitsu,Famitsu*5/2,Introduction
Dragon Quest Heroes I & II for Nintendo Switch,NS,Square Enix,2017,3,3,90000,N/A,N/A,90000,N/A,1,0,0,0,"Action, Miscellaneous, Beat-'Em-Up, Compilation",N/A,N/A,N/A,N/A,N/A,N/A,N/A,N/A,N/A,N/A,N/A,N/A,N/A,#VALUE!,"Dragon Quest Heroes I•II for Nintendo Switch includes additional playable character Ragnar McRyan (voiced by Tomokazu Sugita) fromDragon Quest IV: Chapters of the Chosen, new boss monster Malroth fromDragon Quest II: Luminaries of the Legendary Line, further improved ease of play and operability (adjustments made to make it more comfortable to play, as well as difficulty adjustments), and all of the downloadable content from the PlayStation versions."
Mutant Football League: Dynasty Edition,NS,Nighthawk Interactive,2018,10,30,90000,80000,N/A,N/A,10000,1,1,1,0,"Sports, Team, Football, Arcade",N/A,66,71,N/A,N/A,N/A,N/A,N/A,N/A,N/A,N/A,N/A,N/A,#VALUE!,"Mutant Football League is an American football video game. It is a spiritual successor to Electronic Arts' Mutant League Football. The game was released on Microsoft Windows on October 31, 2017, released for PlayStation 4 and Xbox One on January 19, 2018, and on Nintendo Switch on October 30, 2018."
Shining Resonance Refrain,NS,Sega,2018,7,10,90000,50000,10000,10000,10000,1,1,1,1,"Role-Playing, Action RPG",60,70,78,77,N/A,N/A,N/A,N/A,N/A,N/A,N/A,N/A,N/A,#VALUE!,"Shining Resonance Refrain is a Japanese role-playing game developed by O-Two Inc. and published by Sega. Originally developed by Media.Vision, it is an entry in Sega's Shining series of video games, and an expanded and remastered version of the Japan-only Shining Resonance released for the PlayStation 3 in 2014. While the original PS3 release was not translated into English, Refrain was released in July 2018 for Microsoft Windows, Nintendo Switch, PlayStation 4, and Xbox One platforms."
MXGP 3: The Official Motocross Videogame,NS,Milestone S.r.l.	,2017,11,17,80000,60000,20000,N/A,10000,1,1,1,1,"Racing, Arcade,",N/A,65,65,75,N/A,N/A,N/A,N/A,N/A,N/A,N/A,N/A,N/A,#VALUE!,MXGP3 - The Official Motocross Videogame. Experience all the adrenaline of Motocross with the official Championship's only videogame! Very Positive - 94% of the 18 user reviews in the last 30 days are positive. 94% of 18) Recent. Very Positive - 86% of the 509 user reviews for this game are positive.
Cartoon Network: Battle Crashers,NS,GameMill Entertainment	,2017,10,31,80000,40000,40000,N/A,10000,1,1,1,0,"Action, Beat-'Em-Up",N/A,38,38,N/A,N/A,N/A,N/A,N/A,N/A,N/A,N/A,N/A,N/A,#VALUE!,"Cartoon Network: Battle Crashers is a side-scrolling beat 'em up video game based on multiple Cartoon Network series developed by French studio Magic Pockets and published by GameMill Entertainment in the North American release and Maximum Games in the European release. It was released for PlayStation 4, Xbox One, and Nintendo 3DS on 8 November 2016. A Nintendo DS version was also going to be released, but was cancelled, as GameMill Entertainment's page for the game shows a cover for a Nintendo DS version.[1] The game received extremely negative reviews from several video game journalists, who panned it as a repetitive and boring beat 'em up with bland representations of otherwise unique characters. A port for the Nintendo Switch was released on 31 October 2017."
Ben 10 (2017),NS,Outright Games,2017,11,14,80000,40000,30000,N/A,10000,1,1,1,1,"Action, Beat-'Em-Up",N/A,41,40,N/A,N/A,N/A,N/A,N/A,N/A,N/A,N/A,N/A,N/A,#VALUE!,"It's Hero Time! Some of Ben's most infamous villains are back, and they're threatening the world- and it's up to you to stop them. Unlock and transform into all 10 of Ben's alien forms as you take on dangerous opponents like Zombozo, Queen Bee, and the Weatherheads, and save the day with a combination of explosive combat and fun, mind-bending puzzles as you unravel three all-new episodes."
R.B.I. Baseball 2017,NS,MLB.com,2017,9,5,80000,70000,N/A,N/A,10000,1,1,1,0,"Sports, Team, Baseball, Arcade",N/A,38,47,N/A,N/A,N/A,N/A,N/A,N/A,N/A,N/A,N/A,N/A,#VALUE!,"R.B.I. 2017 has 30 real baseball stadiums, more than 1,000 MLB player profiles, advanced statistics tracking, season simulation and full season roster update. Your Major League Baseball season is here, get ready to play!"
Monster Jam: Crush It,NS,GameMill,2017,10,31,80000,40000,30000,N/A,10000,1,1,1,0,"Racing, Arcade, Automobile",N/A,36,53,N/A,N/A,N/A,N/A,N/A,N/A,N/A,N/A,N/A,N/A,#VALUE!,"The most popular monster truck game in the world, takes players back to the real competition venue to compete. It contains 84 technical challenges, 96 levels, and 25 real monster trucks."
ARK: Survival Evolved,NS,Studio Wildcard,2018,11,30,80000,70000,N/A,N/A,10000,1,1,1,1,"Action Adventure, Survival, Sandbox",40,29,23,N/A,70,N/A,N/A,N/A,N/A,60,N/A,77,N/A,#VALUE!,"Ark: Survival Evolved (stylized as ΛRK) is a 2017 action-adventure survival video game developed by Studio Wildcard, in collaboration with Instinct Games, Efecto Studios, and Virtual Basement. In the game, players must survive being stranded on an island filled with roaming dinosaursand other prehistoric animals, natural hazards, and potentially hostile human players."
Seiken Densetsu Collection,NS,Square Enix,2017,6,1,70000,N/A,N/A,70000,N/A,1,0,0,0,"Action Adventure, Role-Playing",N/A,N/A,N/A,N/A,N/A,N/A,N/A,N/A,N/A,N/A,N/A,N/A,N/A,#VALUE!,"The Mana series, known in Japan as Seiken Densetsu (聖剣伝説, lit. The Legend of the Sacred Sword), is a high fantasy action role-playing gameseries created by Koichi Ishii, with development formerly from Square, and is currently owned by Square Enix. The series began as a handheld side story to Square's flagship franchise Final Fantasy. The Final Fantasy elements were subsequently dropped starting with the second installment, Secret of Mana, in order to become its own series. It has grown to include games of various genres within the fictional world of Mana, with recurring stories involving a world tree, its associated holy sword, and the fight against forces that would steal their power. Several character designs, creatures, and musical themes reappear frequently."
Bass Pro Shops: The Strike - Championship Edition,NS,Planet Entertainment,2018,11,9,70000,60000,N/A,N/A,10000,1,0,0,0,"Sports, Individual",N/A,N/A,N/A,N/A,N/A,N/A,N/A,N/A,N/A,N/A,N/A,N/A,N/A,#VALUE!,"Bass Pro Shops: The Strike is a fishing game developed by Piranha Games and published by XS Games for the Wii, Windows, and Xbox 360 in 2009. A similar title about hunting, Bass Pro Shops: The Hunt, later followed for Wii & Xbox 360 released on June 1, 2010. A Nintendo Switch port, dubbed Bass Pro Shops: The Strike - Championship Edition was released by Planet Entertainment on October 23, 2018."
Poi,NS,Polykid,2017,2,1,70000,50000,10000,N/A,10000,1,1,1,1,"Action, Platformer",50,65,70,N/A,N/A,N/A,N/A,N/A,N/A,N/A,N/A,N/A,N/A,#VALUE!,"Poi is an independent 3D platform game released on Linux, macOS and Microsoft Windows via Steam, Nintendo Switch, PlayStation 4 and Xbox One. Poi was the first game developed by PolyKid, an independent studio made up of graduates from the DigiPen Institute of Technology. Following an unsuccessful Kickstarter campaign in August 2015, the game was released via Steam Early Access the following November and remained in active development until a finished version was released in February 2017, followed by home console ports later that year."
One Piece: Unlimited World Red Deluxe Edition,NS,Namco Bandai Games,2017,9,29,70000,N/A,40000,30000,0,1,1,0,1,"Action, General",N/A,69,71,N/A,N/A,N/A,N/A,N/A,N/A,N/A,N/A,N/A,N/A,#VALUE!,"One Piece: Unlimited World Red is an action-adventure video game based on the famous One Piece manga and anime. This is the thirty-sixth video game based on the series, and the fifth title in the Unlimited sub-series. It was released for the Nintendo 3DS in Japan on November 21, 2013 and released for additional platforms and in more regions the following year.On March 12, 2014, the game was confirmed to be releasing in North America, Europe, and Japan in 2014 on Wii U, PlayStation 3 and PlayStation Vita.The Wii U version does not have a physical retail release in North America and Australia. Whilst other versions were released by July 8, 2014 in North America, the PlayStation Vita version was released in the region on July 14, 2014, and its limited retail release was sold exclusively via GameStop stores."
Wild Guns Reloaded,NS,Natsume,2018,4,17,70000,60000,N/A,N/A,10000,1,1,0,1,"Action, Platformer, Shooter",N/A,80,82,N/A,N/A,N/A,N/A,N/A,N/A,N/A,N/A,N/A,N/A,#VALUE!,"Wild Guns is a 1994 space western shooting gallery video game developed by Natsume for the Super Nintendo Entertainment System. Set in the Wild West with steampunk and sci-fi influences, the story follows Annie and her bounty hunter Clint, seeking revenge for the death of her family. The player controls either Annie or Clint sidestepping and jumping in the foreground while shooting down enemy robots in the background and dodging enemy bullets. These gameplay mechanics combine elements from third-person shooters and light gun games."
Cabela's The Hunt: Championship Edition Bundle,NS,Planet Entertainment,2018,11,9,70000,60000,N/A,N/A,10000,1,0,0,0,"Sports, Individual",N/A,N/A,N/A,N/A,N/A,N/A,N/A,N/A,N/A,N/A,N/A,N/A,N/A,#VALUE!,"The Cabela's® The Hunt Championship Edition Hunting Game Bundle for Nintendo Switch® game system lets you experience the thrill of the hunt while you stalk and kill your prey in some of the most famous hunting spots in North America. This Cabela's video game features multiple hunting games, including season hunt, local multiplayer, and arcade mini-games. Players can experience an authentic hunting experience before pulling the trigger by factoring in range, scent, and stalking ability. You can select weapons, supplies, and gear from an arsenal including rifles, shotguns, side arms, bows, calls, scents, blinds, decoys, scopes, an ATV, and GPS mapping technology."
Sushi Striker: The Way of Sushido,NS,Nintendo,2018,6,8,70000,20000,10000,30000,0,1,0,0,0,Puzzle,79,76,78,N/A,65,N/A,N/A,77.5,N/A,70,N/A,N/A,N/A,#VALUE!,"Sushi Striker: The Way of Sushido is an action-puzzle video game developed by indieszero and Nintendo.The game was released worldwide for the Nintendo 3DS and Nintendo Switch on June 8, 2018.Sushi Striker takes place in a world where sushi has been made forbidden by its ruling empire. The protagonist, Musashi, attempts to revert this ban on sushi. The game consists of one-on-one battles with CPU-controlled opponents, where the player must match sushi plates of the same color on a series of conveyor belts to cause damage to the opponent."
Hello Neighbor: Hide & Seek,NS,Gearbox Software,2018,12,7,70000,60000,N/A,N/A,10000,1,1,1,1,"Action Adventure, Survival",N/A,39,35,36,N/A,N/A,N/A,37.5,N/A,30,N/A,40,N/A,#VALUE!,"Hello Neighbor is a survival horror stealth game developed by Russian video game studio Dynamic Pixels and published by TinyBuild. Initially released as public alphas from 2016 to 2017, it received a final release for Microsoft Windows and Xbox One on 8 December 2017, and later for PlayStation 4, Nintendo Switch, IOS and Android on 26 July 2018."
BlazBlue: Cross Tag Battle,NS,Arc System Works,2018,6,5,70000,40000,10000,10000,10000,1,1,0,1,"Action, Fighting",80,79,77,74,80,N/A,N/A,N/A,N/A,90,N/A,83,35,87.5,"BlazBlue: Cross Tag Battle is a 2D crossover fighting game developed and published by Arc System Works, and released on PlayStation 4, Nintendo Switch and Microsoft Windows. It features different characters from each series, including BlazBlue, Persona 4 Arena, Under Night In-Birth and  RWBY. After the game was released, characters from Arcana Heart, Senran Kagura and Akatsuki Blitzkampf, were added as downloadable content . An arcade version was released in 2019. The game received mostly positive reviews, with praise for the visuals, music, online functionality and mechanics. However, it was criticised for lack of overall content at launch and DLC practices."
Scribblenauts: Showdown,NS,Warner Bros. Interactive,2018,3,6,70000,30000,30000,N/A,10000,1,1,1,0,"Puzzle, Action",N/A,47,44,N/A,N/A,30,N/A,N/A,N/A,N/A,N/A,N/A,N/A,#VALUE!,"Scribblenauts Showdown is a party game developed by Shiver Entertainment and published by Warner Bros. Interactive Entertainment for the Nintendo Switch, PlayStation 4, and Xbox One in March 2018. The game is the sixth installment in the Scribblenauts franchise, created by 5th Cell. Showdown sees players playing minigames against other players or CPUs."
Nights of Azure 2: Bride of the New Moon,NS,Tecmo Koei,2017,10,24,60000,20000,20000,10000,0,1,1,0,1,"Role-Playing, Action RPG",N/A,66,65,65,50,N/A,N/A,N/A,N/A,N/A,N/A,N/A,32,80,"Nights of Azure is a 2015 action role-playing video game developed by Gust and published by Koei Tecmo for the PlayStation 3, PlayStation 4, PlayStation Vita and Microsoft Windows.The PlayStation 4 version received a North American release on March 29, 2016, with a European release following on April 1, 2016, and a Microsoft Windows release on February 7, 2017."
America's Greatest Game Shows: Wheel of Fortune and Jeopardy!,NS,Ubisoft,2018,10,30,60000,60000,N/A,N/A,10000,1,1,1,0,"Miscellaneous, Compilation",N/A,N/A,N/A,N/A,N/A,N/A,N/A,N/A,N/A,N/A,N/A,N/A,N/A,#VALUE!,"Enjoy an authentic TV show experience with America's Greatest Game Shows: Wheel of Fortune® & Jeopardy!® Play anytime, anywhere. Perfect for a family-friendly game night – or challenge yourself against players around the world online."
Ittle Dew 2+,NS,Nicalis,2017,11,14,60000,60000,N/A,N/A,10000,1,1,1,1,"Role-Playing, Action Adventure, General, Action RPG",N/A,77,77,N/A,N/A,N/A,N/A,N/A,N/A,N/A,N/A,N/A,N/A,#VALUE!,"Ittle Dew 2 is an action-adventure game developed by Swedish indie studio Ludosity and originally published by Nicalis, and the sequel to the 2013 title Ittle Dew. Ittle Dew 2 was released for Microsoft Windows, PlayStation 4, and Xbox One on November 15, 2016. An updated version of the game entitled Ittle Dew 2+ was released for the Nintendo Switch on November 14, 2017; the updated content was eventually released on the Windows version on May 26, 2019. The Nintendo Switch is the only platform that received a physical release of the game."
Touhou Kobuto V: Burst Battle,NS,NIS America,2017,10,10,60000,40000,20000,N/A,10000,1,1,1,0,"Action, Fighting",N/A,38,53,N/A,N/A,N/A,N/A,N/A,N/A,N/A,N/A,N/A,N/A,#VALUE!,"Touhou Kobuto V: Burst Battle is a bullet-hell battle game that takes place in the Touhou universe. Take control of one of nine Touhou characters and eliminate your opponent using bullet-hell patterns, melee attacks, or spell cards!"
Victor Vran: Overkill Edition,NS,Wired Productions,2018,8,28,60000,60000,N/A,N/A,10000,1,1,1,1,"Role-Playing, Action RPG",N/A,82,81,85,N/A,N/A,N/A,N/A,N/A,N/A,N/A,N/A,N/A,#VALUE!,"""Victor Vran: Overkill Edition"" will let players decide how to play the game. With diversified and powerful weapons, equipment, evil demon powers, destiny cards, etc., players can create personalized characters that players can use Combine skills and weapons to destroy hordes of monsters. In the game, players will be able to team up with friends to explore the story of the dark world and enjoy the fun of joint adventures. Players even have to find ways to find hidden treasure chests and find ways to jump on broken buildings to explore; there are many kinds of games in the game Monsters and randomly generated items."
Stern Pinball Arcade,NS,Alliance Digital Media,2017,12,12,60000,50000,10000,N/A,10000,1,1,1,1,Action,N/A,65,65,85,N/A,N/A,N/A,N/A,N/A,N/A,N/A,N/A,N/A,#VALUE!,"Stern Pinball Arcade is a pinball simulation video game developed by FarSight Studios and a spin-off of their earlier title The Pinball Arcade. This game includes recreations of pinball machines manufactured or licensed by Stern Pinball Inc., which also owns the rights to machines from Data East and Sega Pinball."
Asterix and Obelix XXL2,NS,Microids,2018,11,29,60000,N/A,60000,N/A,0,1,1,1,1,"Action, Beat-'Em-Up",65,N/A,N/A,N/A,N/A,N/A,N/A,N/A,N/A,N/A,N/A,N/A,N/A,#VALUE!,"Asterix & Obelix XXL 2: Mission: Las Vegum is an action-adventure game for Windows and PlayStation 2, the sequel to Asterix & Obelix XXL. It was released in June 2006 in Europe. The game stars the French comic book characters Asterix and Obelix, and features spoofs to many classic games, in the same fashion that the comics spoof historical characters and make many cultural references. One such example of this is the box art that has a passing resemblance to the one seen in Grand Theft Auto III."
Disgaea 1 Complete,NS,NIS America,2018,10,9,60000,30000,10000,10000,0,1,1,0,0,"Strategy, Turn-Based, Tactics",80,76,78,88,N/A,N/A,N/A,N/A,N/A,N/A,N/A,N/A,N/A,#VALUE!,Disgaea: Hour of Darkness is a tactical role-playing video game developed and published by Nippon Ichi Software for the Sony PlayStation 2 video game console.
Azure Striker Gunvolt: Striker Pack,NS,Nighthawk Interactive,2017,11,21,60000,30000,10000,10000,0,1,1,0,0,"Miscellaneous, Compilation",N/A,82,79,N/A,85,N/A,N/A,N/A,N/A,80,N/A,N/A,N/A,#VALUE!,"Azure Striker Gunvolt 2, known as Armed Blue: Gunvolt Sou (蒼き雷霆アームドブルーガンヴォルト爪) in Japan, is a 2D side-scrolling action-platform video game developed and published by Inti Creates for the Nintendo 3DS. The sequel to Azure Striker Gunvolt, it was released in Japan in August 2016 and worldwide in September 2016. A physical release containing the game and its predecessor, titled Azure Striker Gunvolt: Striker Pack, was released alongside the digital release in Japan and North America. A Nintendo Switch version was released as part of a port of the Striker Pack on August 31, 2017. A PlayStation 4 version was released as part of a port of the Striker Pack on April 23, 2020. The game was later ported to PC on June 22, 2020. A sequel, Azure Striker Gunvolt 3 has been announced for Nintendo Switch, which is set to release in 2022."
Spintires: MudRunner - American Wilds,NS,Maximum Games,2018,10,23,60000,50000,N/A,N/A,10000,1,1,1,0,Simulation,N/A,N/A,N/A,N/A,N/A,N/A,N/A,N/A,N/A,N/A,N/A,N/A,N/A,#VALUE!,"Mudrunner, stylised as  MudRunner (Formerly Spintires: Mudrunner) is an off-roading simulation game developed by Saber Interactive and published by Focus Home Interactive. It was released on October 31, 2017 for Microsoft Windows, PlayStation 4, and Xbox One and is a spin-off/sequel of the 2014 Windows-exclusive Spintires, which was developed by Oovee Game Studios. It was later added to the Xbox Game Passin December 2018. Similar to Spintires, MudRunner has the player control off-road vehicles as they traverse between locations to complete objectives. The game was released in Japan on Nintendo Switch on June 18, 2020. A sequel to MudRunner was released on April 28, 2020 titled SnowRunner."
Portal Knights,NS,505 Games,2018,2,13,60000,20000,20000,10000,0,1,1,1,1,"Action, Role-Playing, General, Action RPG",N/A,74,77,70,N/A,N/A,N/A,N/A,N/A,N/A,N/A,N/A,N/A,#VALUE!,"Portal Knights is an independent survival action role-playing video game developed by Keen Games and published by 505 Games. It was first released on Steam on 18 May 2017 and subsequently released for PlayStation 4, Xbox One, Nintendo Switch, Android, and iOS."
One Piece: Pirate Warriors 3 - Deluxe Edition,NS,Bandai Namco Entertainment	,2018,5,11,60000,N/A,10000,50000,0,1,1,1,1,"Action, Beat-'Em-Up",85,76,82,70,75,N/A,N/A,N/A,70,N/A,N/A,69,36,90,"""ONE PIECE WARRIORS 3"" (Japanese: ワンピース海贼无双3, English: One Piece: Pirate Warriors 3, official translation in mainland China as ""One Piece: Pirate Warriors 3"") was developed by Koei Tecumo, based on ""ONE PIECE"" It is a Wushuang action game with the theme of PlayStation 4, PlayStation 3, PlayStation Vita, and Steam. It is published by Namco Bandai. The release date is March 26, 2015. On December 21, 2017, the ""One Piece: One Piece 3 Deluxe Edition"" containing various costumes and challenge plots (DLC) that have been released will be released on the Nintendo Switch platform."
Party Arcade,NS,Planet Entertainment	,2018,11,9,60000,50000,N/A,N/A,10000,1,1,1,0,"Miscellaneous, Party, Minigame",N/A,N/A,N/A,N/A,N/A,N/A,N/A,N/A,N/A,N/A,N/A,N/A,N/A,#VALUE!,"Party Arcade is a family friendly party game set in a modern virtual arcade. With 13 addictive games, players collect tickets, unlock different equipment skins, and battle against family and friends at home, or online around the world!"
The End is Nigh,NS,Nicalis,2017,12,12,60000,50000,N/A,N/A,10000,1,1,0,1,"Action, Platformer",N/A,80,81,N/A,85,70,N/A,82.5,N/A,N/A,N/A,N/A,N/A,#VALUE!,"The End Is Nigh is a platforming adventure video game developed by Edmund McMillen and Tyler Glaiel. The game was released on July 12, 2017 on Microsoft Windows via Steam. Ports of the game were released on August 15, 2017 on macOS, December 12, 2017 for Linux and Nintendo Switch, and on April 30, 2019 for PlayStation 4. The game has been described as a spiritual successor to McMillen's Super Meat Boy."
Tiny Barbarian DX,NS,Nicalis,2017,10,10,60000,50000,N/A,N/A,10000,1,0,0,1,"Action, General",N/A,77,77,N/A,N/A,N/A,N/A,N/A,N/A,N/A,N/A,N/A,N/A,#VALUE!,"Inspired by heroic fantasy novels, Little Barbarian DX is an action game where barbarians pursue revenge. Can you split the skull of your enemy, loot all the loot, and save the Babylon of your dreams?"
Owlboy,NS,Soedesco,2018,5,29,50000,30000,10000,N/A,10000,1,1,1,1,"Action Adventure, General",90,87,74,83,100,N/A,N/A,90,N/A,90,N/A,93,N/A,#VALUE!,"Owlboy is a platform-adventure video game created by the Norwegian independent developer; D-Pad Studio. The game is notable for its long development cycle, which began in 2007, and was released in November 2016."
Little Nightmares,NS,Bandai Namco Entertainment	,2018,5,18,50000,N/A,20000,30000,0,1,1,1,1,"Action Adventure, Linear",N/A,79,81,79,85,N/A,N/A,90,70,80,80,88,N/A,#VALUE!,"Little Nightmares is a puzzle-platform horror adventure game developed by Tarsier Studios and published by Bandai Namco Entertainment for Microsoft Windows, Nintendo Switch, PlayStation 4, Xbox One, and Stadia. Set in a mysterious world, Little Nightmares follows the journey of Six, a hungry little girl who must escape the Maw, an iron vessel inhabited by monstrous, twisted beings. The game received positive reviews upon release with critics praising its atmosphere, graphics, and sound, while criticizing its checkpoint system and short length. A sequel, Little Nightmares II, was released in February 2021."
Scribblenauts Mega Pack,NS,Warner Bros. Interactive Entertainment	,2018,9,18,50000,50000,N/A,N/A,10000,1,1,1,0,"Miscellaneous, Compilation",N/A,76,75,N/A,N/A,N/A,N/A,N/A,N/A,N/A,N/A,N/A,N/A,#VALUE!,"Get the best of Scribblenauts with Scribblenauts Mega Pack! Two classic games with ALL-NEW content to explore!Scribblenauts Unlimited - Journey into Maxwell and Lily's world as you use the power of your imagination to solve exciting puzzles in endless ways. Discover the story of Maxwell's 41 siblings and create unique objects of your own to share online with your friends! Scribblenauts Unmasked: A DC Comics Adventure - Challenge your wits in an epic adventure against earth's mightiest villains! Invent your own alter ego with the Hero Creator. Join your favorite DC Comics super heroes to explore iconic all-new locations like TITANS TOWER & BELLE REVE and restore order to the universe.With Scribblenauts Unlimited & Scribblenauts Unmasked combined, the fun is limitless!"
Brawlout,NS,Merge Games,2018,6,26,50000,N/A,N/A,N/A,N/A,1,1,1,1,"Action, Fighting",62,60,57,N/A,N/A,N/A,N/A,N/A,N/A,N/A,N/A,N/A,N/A,#VALUE!,"Brawlout is a fighting game developed and published by Angry Mob Games for Microsoft Windows, Nintendo Switch, PlayStation 4, and Xbox One. The game was revealed at EVO in July 2016, and went into closed beta in December 2016. The game was initially released as early access for Microsoft Windows on April 20, 2017. Various outlets, such as Engadget, have compared Brawlout to the Super Smash Bros. series."
Senran Kagura Reflexions        ,NS,Xseed Games,2018,9,13,50000,N/A,N/A,N/A,N/A,1,0,0,1,"Action, Adventure, General",N/A,39,74,N/A,N/A,N/A,N/A,N/A,N/A,N/A,N/A,N/A,N/A,#VALUE!,"SENRAN KAGURA Reflexions. Can you feel it? The beating of her heart... In a classroom after school, learn the ways of ""reflexology"" by syncing with her heart and body. In SENRAN KAGURA Reflexions, interact with your favorite shinobi heroine like never before."
VOEZ,NS,PM Studios,2018,8,14,50000,N/A,N/A,N/A,N/A,1,0,0,0,"Action, Rhythm, Music",85,81,80,85,N/A,N/A,N/A,N/A,N/A,N/A,N/A,N/A,N/A,#VALUE!,"Voez (stylized as VOEZ) is a rhythm game developed by Rayark, initially released in May 2016 for iOS devices,[4] while an Android version of the game was released one week later in June 2016.[5] In February 2017, it was announced that the game would be released on the Nintendo Switchby Japanese game publisher Flyhigh Works,[2] and was released in March 2017 worldwide."
My Riding Stables: Life with Horses,NS,TREVA Entertainment,2018,11,13,50000,40000,N/A,N/A,10000,1,1,0,0,Other,N/A,N/A,N/A,N/A,N/A,N/A,N/A,N/A,N/A,N/A,N/A,N/A,N/A,#VALUE!,"My Riding Stables : Life With Horses also known as My Riding Stables 2 : A Life For The Horses or Mein Gestüt : Ein Leben für die Pferde in Germany, is a fun and challenging horse game where you play as a young girl that will rebuild the The Riding Stables."
