game,console,Publisher,Release Year,Release Month,Release Day,Total Shipped,NA Sales,PAL Sales,Japan Sales,Other Sales,NS,PS4,XBOX ONE,PC,Genre(s),VGChartz Score,Metacritic(Critic),Metacritic(User),4Players,Destructoid,Edge,EGM,Game Informer,GameRevolution,GameSpot,GamesRadar+,IGN,Famitsu,Famitsu*5/2,Introduction
Madden NFL 18,XBOX ONE,EA Sports,2017,8,25,1910000,1630000,70000,N/A,200000,0,1,1,0,"Sports, Football, Sim, Team",88,82,44,84,70,N/A,70,82.5,60,90,80,86,N/A,#VALUE!,"Madden NFL 18 is an American football sports video game based on the National Football League, developed and published by EA Sports for PlayStation 4 and Xbox One. The game features New England Patriots quarterback Tom Brady on the cover, the second straight year a Patriots player has had the distinction, following tight end Rob Gronkowski."
Forza Horizon 4,XBOX ONE,Microsoft Studios,2018,10,2,1840000,740000,950000,10000,150000,0,0,1,1,"Racing, Simulation, Automobile",92,92,82,89,90,N/A,80,92.5,90,90,80,96,N/A,#VALUE!,"Forza Horizon 4 is a 2018 racing video game developed by Playground Games and published by Microsoft Studios.The game set in an open world environment based in a fictionalised Great Britain, with regions that include condensed representations of Edinburgh, the Lake District (including Derwentwater), Ambleside and the Cotswolds (including Broadway), Bamburgh among others. "
The Elder Scrolls V: Skyrim Special Edition,XBOX ONE,Bethesda Softworks,2016,10,28,1830000,1130000,530000,N/A,170000,1,1,1,1,"Role-Playing, Western-Style",81,82,76,N/A,N/A,N/A,N/A,95,N/A,90,N/A,95,40,100,"The Elder Scrolls V: Skyrim is an open world action role-playing video game developed by Bethesda Game Studios and published by Bethesda Softworks. It is the fifth main installment in The Elder Scrolls series.The game's main story revolves around the player's character, the Dragonborn, on their quest to defeat Alduin the World-Eater, a dragon who is prophesied to destroy the world. "
Far Cry 5,XBOX ONE,Ubisoft,2018,3,27,1780000,1140000,470000,N/A,170000,0,1,1,1,"Action, Shooter, First-Person, Arcade",72,82,68,70,75,60,75,75,70,90,80,89,N/A,#VALUE!,"Far Cry 5 is a 2018 first-person shooter game developed by Ubisoft Montreal and Ubisoft Toronto and published by Ubisoft. It is the fifth main installment in the Far Cry series.The game takes place in Hope County, a fictional region of Montana, United States. The main story revolves around the Project at Eden's Gate, a doomsday cult that has taken over the county at the command of its charismatic and powerful leader, Joseph Seed. Players control an unnamed junior deputy sheriff who becomes trapped in Hope County and must work alongside factions of a resistance to liberate the county from the despotic rule of the Seeds and Eden's Gate. Gameplay focuses on combat and exploration; players battle enemy soldiers and dangerous wildlife using a wide array of weapons. "
Mortal Kombat X,XBOX ONE,Warner Bros. Interactive Entertainment	,2015,4,14,1740000,1340000,230000,N/A,180000,0,1,1,1,"Action, Fighting",N/A,86,75,85,80,N/A,75,92.5,80,80,70,84,N/A,#VALUE!,"Mortal Kombat X is a fighting video game developed by NetherRealm Studios and published by Warner Bros.Like previous Mortal Kombat games, Mortal Kombat X's gameplay consists of two players, or one player and the CPU, fighting against each other with their selected character, using a large, varied array of character-specific attacks. The game contains several modes, such as a story mode, which takes place twenty-five years after the previous Mortal Kombat game, several 'Tower' modes, which feature dynamically changing challenges, numerous online modes, and the 'Krypt', a mode played in a first person perspective, where players explore the areas unlocking a variety of in-game items."
NBA 2K15,XBOX ONE,2K Sports,2014,10,7,1740000,1390000,180000,N/A,180000,0,1,1,1,"Arcade, Sports, Basketball",N/A,82,62,85,N/A,N/A,60,N/A,N/A,90,N/A,78,N/A,#VALUE!,"NBA 2K15 is a basketball simulation video game developed by Visual Concepts and published by 2K Sports. It is the sixteenth installment in the NBA 2K franchise and the successor to NBA 2K14. NBA 2K15 allows players to scan their faces into the game for created players, using the PlayStation Camera on PlayStation 4 or the Kinect on the Xbox One. The 3D mapping process creates a realistic rendition of the gamer's face to make their gaming experience as real as possible. "
NBA 2K19,XBOX ONE,2K Sports,2018,9,11,1740000,1470000,80000,N/A,180000,1,1,1,1,"Arcade, Sports, Basketball",N/A,83,28,82,N/A,N/A,70,90,N/A,N/A,70,85,N/A,#VALUE!,"NBA 2K19 is a basketball simulation video game developed by Visual Concepts and published by 2K Sports, based on the National Basketball Association (NBA). It is the 20th installment in the NBA 2K franchise, the successor to NBA 2K18, and the predecessor to NBA 2K20. Giannis Antetokounmpo of the Milwaukee Bucks is the cover athlete for the standard edition, while LeBron James (who was also the cover athlete of NBA 2K14) of the Los Angeles Lakers is the cover athlete for the 20th Anniversary Edition.Players build their own custom team, selecting the players, jerseys, logos, coach, court, and other basketball related things, and play with their team in basketball tournament-style competitions against other players' teams. "
Far Cry 4,XBOX ONE,Ubisoft,2014,11,18,1680000,850000,680000,20000,140000,0,1,1,1,"Action, Shooter, First-Person, Modern, Arcade",85,82,76,70,90,N/A,80,87.5,80,N/A,80,85,N/A,#VALUE!,"Far Cry 4 is a 2014 first-person shooter game developed by Ubisoft Montreal and published by Ubisoft. It is the successor to the 2012 video game Far Cry 3, and the fourth main installment in the Far Cry series. The game takes place in Kyrat, a fictional Himalayan country. The main story follows Ajay Ghale, a young Kyrati-American, as he is caught in a civil war involving Kyrat's Royal Army, controlled by tyrannical king Pagan Min, and a rebel movement called the Golden Path. Gameplay focuses on combat and exploration; players battle enemy soldiers and dangerous wildlife using a wide array of weapons. "
Watch Dogs,XBOX ONE,Ubisoft,2014,5,27,1640000,910000,590000,N/A,150000,0,1,1,1,"Modern, Action Adventure, General, Open-World",N/A,78,60,73,80,N/A,N/A,85,N/A,80,80,84,N/A,#VALUE!,"Watch Dogs (stylized as WATCH_DOGS) is a 2014 action-adventure game developed by Ubisoft Montreal and published by Ubisoft. It is the first installment in the Watch Dogs series. The game is played from a third-person perspective, and its world is navigated on foot or by vehicle. Set within a fictionalized version of the Chicagoland area in 2013, the single-player story follows grey hat hacker and vigilante Aiden Pearce's quest for revenge after the killing of his niece."
Tom Clancy's Ghost Recon Wildlands,XBOX ONE,Ubisoft,2017,3,7,1610000,980000,480000,N/A,150000,0,1,1,1,"Action Adventure, Open-World",77,76,68,63,N/A,N/A,70,82.5,80,70,90,79,N/A,#VALUE!,"Tom Clancy's Ghost Recon Wildlands is a third person tactical shooter video game developed by Ubisoft Paris and Ubisoft Milan and published by Ubisoft. Players play as members of the Delta Company, First Battalion, 5th Special Forces Group, also known as ""Ghosts"", a fictional elite special operations unit of the United States Army under the Joint Special Operations Command."
Madden NFL 15,XBOX ONE,EA Sports,2014,8,26,1600000,1340000,100000,N/A,170000,0,1,1,0,"Sports, Football, Sim, Team",N/A,80,62,84,60,N/A,N/A,N/A,N/A,70,80,87,N/A,#VALUE!,"Madden NFL 15 is an American football sports video game based on the National Football League and published by EA Sports.As in previous years, EA Sports conducted a fan vote via ESPN to elect the cover athlete for the game.Seattle Seahawks cornerback Richard Sherman won the cover vote and the rest of the Legion of Boom defense was featured on the games start menu.["
Batman: Arkham Knight        ,XBOX ONE,Warner Bros. Interactive Entertainment	,2015,6,23,1580000,970000,460000,N/A,140000,0,1,1,1,"General, Fantasy, Action Adventure, Open-World",N/A,85,71,67,70,80,N/A,95,N/A,70,80,92,N/A,#VALUE!,"Batman: Arkham Knight is a 2015 action-adventure game developed by Rocksteady Studios and published by Warner Bros. The game is presented from a third-person perspective, with a primary focus on Batman's melee combat, stealth abilities, detective skills, and gadgets. Batman can freely move around the open world of Gotham City, interacting with characters and undertaking missions, and unlocking new areas by progressing through the main story or obtaining new equipment. "
Battlefield V,XBOX ONE,Electronic Arts,2018,11,20,1550000,1050000,350000,N/A,150000,0,1,1,1,"Action, Shooter, First-Person, Tactical",N/A,78,29,85,80,N/A,N/A,80,50,80,70,75,N/A,#VALUE!,"Battlefield V is a first-person shooter video game developed by EA DICE and published by Electronic Arts,which is the sixteenth installment in the Battlefield series. Battlefield V is focused extensively on party-based features and mechanics, scarcity of resources, and removing ""abstractions"" from game mechanics to increase realism."
Forza Motorsport 7,XBOX ONE,Microsoft Studios	,2017,10,3,1520000,580000,810000,10000,120000,0,0,1,1,"Racing, Simulation, Automobile",89,86,63,83,70,N/A,75,77.5,N/A,80,100,92,N/A,#VALUE!,"Forza Motorsport 7 is a 2017 racing video game developed by Turn 10 Studios and published by Microsoft Studios, serving as the tenth installment in the Forza series. Forza Motorsport 7 features over 700 cars—including new Forza Edition cars, most of which have been brought over from Forza Horizon 3 and more than 200 different configurations to race on across 32 locations at launch, including all from Forza Motorsport 6; a fictional street circuit in Dubai is one of the new circuits and several tracks returning from Forza Motorsport 4 including Maple Valley Raceway, Mugello Circuit and Suzuka Circuit."
Madden NFL 19,XBOX ONE,EA Sports,2018,8,10,1510000,1330000,20000,N/A,160000,0,1,1,1,"Sports, Football, Sim, Team",N/A,81,29,83,N/A,N/A,70,80,N/A,80,90,89,N/A,#VALUE!,"Madden NFL 19 is an American football sports video game based on the National Football League (NFL), developed and published by EA Sports.Madden NFL 19 featured ""real player motions,"" allowing players to push blockers to gain more yards while running and make realistic cuts up-field after the catch, as well as take part in interactive touchdown celebrations for the first time since Madden NFL 09 including team celebrations, which were made legal by the NFL for the 2017 season."
ARK: Survival Evolved,XBOX ONE,Studio Wildcard,2017,8,29,1500000,N/A,N/A,N/A,N/A,1,1,1,1,"Action Adventure, Survival, Sandbox",N/A,69,47,N/A,70,N/A,N/A,N/A,N/A,60,N/A,77,N/A,#VALUE!,"Ark: Survival Evolved (stylized as ΛRK) is a 2017 action-adventure survival video game developed by Studio Wildcard.The game is played from either a third-person or first-person perspective and its open world is navigated on foot or by riding a prehistoric animal. Players can use firearms and improvised weapons to defend against hostile humans and creatures, with the ability to build bases as defense on the ground and on some creatures. The game has both single-player and multiplayer options. Multiplayer allows the option to form tribes of members in a server. The max number of tribe mates varies from each server. In this mode all tamed dinosaurs and building structures are usually shared between the members. "
Dying Light,XBOX ONE,Warner Bros. Interactive Entertainment	,2016,2,6,1470000,1010000,310000,10000,140000,0,1,1,1,"Horror, Action Adventure, Survival",N/A,74,78,N/A,70,N/A,N/A,85,N/A,70,N/A,85,N/A,#VALUE!,"Dying Light is a 2015 survival horror video game developed by Techland and published by Warner Bros. Interactive Entertainment. The game's story follows an undercover agent named Kyle Crane who is sent to infiltrate a quarantine zone in a Middle-eastern city called Harran. It features an enemy-infested, open-world city with a dynamic day–night cycle, in which zombies are slow and clumsy during daytime but become extremely aggressive at night. The gameplay is focused on weapons-based combat and parkour, allowing players to choose fight or flight when presented with dangers. "
Ryse: Son of Rome,XBOX ONE,Microsoft Studios,2013,11,22,1470000,840000,490000,0,130000,0,0,1,1,"Action Adventure, Fantasy, General",N/A,60,63,46,50,N/A,75,60,N/A,40,70,68,N/A,#VALUE!,"Ryse: Son of Rome is a third-person action-adventure hack and slash video game developed by Crytek and published by Microsoft Studios. Set in an alternate version of Ancient Rome, Ryse follows the life of the Roman centurion Marius Titus as he becomes one of the leaders in the Roman Legion. Gameplay revolves around Marius using his sword to strike enemies and shield to deflect attacks. Execution sequences are featured in the game, which are quick-time events that serve as an extension to combat. The game features a cooperative multiplayer mode, which tasks players to fight against waves of enemies in maps that are changing dynamically."
Forza Horizon 2,XBOX ONE,Microsoft Studios,2014,9,30,1460000,560000,790000,10000,110000,0,0,1,0,"Driving, Racing, Simulation, Automobile",N/A,86,83,86,95,N/A,N/A,N/A,N/A,N/A,80,90,N/A,#VALUE!,"Forza Horizon 2 is a 2014 racing video game developed for Microsoft's Xbox One and Xbox 360 consoles.The player participates in the Horizon Festival, a fictional racing competition set within Southern France and Northern Italy.The game has approximately three times more drivable area than that of its predecessor Forza Horizon, with events set in Provence, Liguria and Côte d'Azur(Nice), among other regions."
Doom (2016),XBOX ONE,Bethesda Softworks,2016,5,13,1450000,760000,570000,N/A,130000,1,1,1,1,"Action, Shooter, First-Person, Arcade",N/A,87,85,77,90,N/A,85,87.5,90,80,100,71,N/A,#VALUE!,"Doom is a 2016 first-person shooter game developed by id Software and published by Bethesda Softworks. Players take the role of an unnamed space marine, known as the Doom Slayer, as he battles demonic forces from Hell that have been unleashed by the Union Aerospace Corporation within their energy-mining facility on Mars. The gameplay returns to a faster pace with more open-ended levels, closer to the first two games than the slower survival horror approach of Doom 3. It also features environment traversal, character upgrades, and the ability to perform executions known as ""glory kills""."
Assassin's Creed Syndicate,XBOX ONE,Ubisoft,2015,10,23,1440000,710000,610000,N/A,120000,0,1,1,1,"Historic, Action Adventure, Open-World",N/A,78,64,66,75,N/A,85,90,80,90,80,82,N/A,#VALUE!,"Assassin's Creed Syndicate is an action-adventure video game developed by Ubisoft Quebec and published by Ubisoft. It is the ninth major installment in the Assassin's Creed series, and the successor to 2014's Assassin's Creed Unity.The game is played from a third-person perspective and its world is navigated on foot or by carriage. The game introduces new travelling systems and refined combat and stealth mechanics. Players control the two lead protagonists throughout the game's story, switching between them both during and outside of missions."
Middle-Earth: Shadow of Mordor,XBOX ONE,Warner Bros. Interactive Entertainment	,2014,9,30,1420000,770000,520000,10000,120000,0,1,1,1,"Fantasy, Action Adventure, Open-World",N/A,87,79,N/A,60,N/A,N/A,82.5,N/A,80,90,93,N/A,#VALUE!,"Middle-earth: Shadow of Mordor is a 2014 action-adventure video game developed by Monolith Productions and published by Warner Bros.The player controls Talion, a Gondorian Ranger who bonds with the wraith of the Elf Lord Celebrimbor, as the two set out to avenge the deaths of their loved ones. Players can engage in melee combat, and use wraith abilities to fight and manipulate enemies. The game introduces the Nemesis System, which allows the artificial intelligence of non-playable characters to remember their prior actions against the game's protagonist and react accordingly."
Assassin's Creed Odyssey	,XBOX ONE,Ubisoft,2018,10,5,1390000,910000,350000,N/A,130000,0,1,1,1,"Action Adventure, Historic, Open-World",N/A,87,62,84,N/A,N/A,85,82.5,N/A,80,100,92,N/A,#VALUE!,"Assassin's Creed Odyssey is an action role-playing video game developed by Ubisoft Quebec and published by Ubisoft.It is the eleventh major installment, and 21st overall, in the Assassin's Creed series and the successor to 2017's Assassin's Creed Origins.  Players control a male or female mercenary (Ancient Greek: μίσθιος misthios) who fights on both sides of the conflict as they attempt to find their family.They inherit his broken spear, which is forged into a blade to become a weapon that grants the player special abilities in combat. The game uses a skill tree system that allows the player to unlock new abilities. The three skill trees are ""hunter"", which focuses on ranged attacks through the use of a bow & arrow, ""warrior"", which focuses on weapons-based combat (swords, spears, axes etc.), and ""assassin"", which focuses on stealth and silent take-downs."
Rocket League,XBOX ONE,505 Games,2016,7,5,1380000,520000,750000,N/A,110000,1,1,1,1,"Sports, Soccer, Arcade",80,85,84,70,N/A,N/A,N/A,N/A,N/A,90,N/A,93,N/A,#VALUE!,"Rocket League is a vehicular soccer video game developed and published by Psyonix. In June 2016, 505 Games began distributing a physical retail version for PlayStation 4 and Xbox One, with Warner Bros.Described as ""soccer, but with rocket-powered cars"", Rocket League has up to eight players assigned to each of the two teams, using rocket-powered vehicles to hit a ball into their opponent's goal and score points over the course of a match. The game includes single-player and multiplayer modes that can be played both locally and online, including cross-platform play between all versions. Later updates for the game enabled the ability to modify core rules and added new game modes, including ones based on ice hockey and basketball."
The Elder Scrolls Online: Tamriel Unlimited,XBOX ONE,Bethesda Softworks,2015,6,9,1380000,860000,390000,N/A,130000,0,1,1,1,"First-Person, Fantasy, Role-Playing, Massively Multiplayer",N/A,77,83,82,N/A,N/A,N/A,N/A,80,60,N/A,80,N/A,#VALUE!,"The Elder Scrolls Online is a massively multiplayer online role-playing game (MMORPG) developed by ZeniMax Online Studios and published by Bethesda Softworks.The game is set in the continent of Tamriel and features a storyline indirectly connected with the other games in the Elder Scrolls franchise. It had been in development for seven years before its release in 2014. It initially received mixed reviews, but these improved significantly with the re-release and rebranding as The Elder Scrolls Online: Tamriel Unlimited, with critics praising the changes that were made."
Titanfall 2,XBOX ONE,Electronic Arts	,2016,10,28,1370000,880000,370000,N/A,130000,0,1,1,1,"Action, Shooter, First-Person, Arcade",N/A,87,84,87,85,N/A,N/A,95,80,90,90,90,N/A,#VALUE!,"Titanfall 2 is a first-person shooter video game, developed by Respawn Entertainment and published by Electronic Arts.In Titanfall 2, players control Titans, mecha-style exoskeletons and their pilots, who are agile and equipped with a variety of skills ranging from wall-running to cloaking. Set in a science fiction universe, the single-player campaign follows the story of Jack Cooper, a rifleman from the Frontier Militia, who bonds with his mentor's Titan BT-7274 after his mentor is killed in action. Together, they embark on a quest to stop the Interstellar Manufacturing Corporation (IMC) from launching a superweapon that is threatening to destroy the Militia planet Harmony."
Watch Dogs 2,XBOX ONE,Ubisoft,2016,11,15,1350000,710000,530000,N/A,120000,0,1,1,1,"Modern, Action Adventure, General, Open-World",N/A,81,73,83,85,N/A,80,77.5,90,N/A,N/A,85,N/A,#VALUE!,"Watch Dogs 2 (stylized as WATCH_DOGS 2) is a 2016 action-adventure game developed by Ubisoft Montreal and published by Ubisoft. It is the sequel to 2014's Watch Dogs and the second installment in the Watch Dogs series.Set within a fictionalized version of the San Francisco Bay Area, the game is played from a third-person perspective and its open world is navigated on-foot or by vehicle. Players control Marcus Holloway, a hacker who works with the hacking group DedSec to take down the city's advanced surveillance system known as ctOS. There are multiple ways to complete missions, and each successful assignment increases the follower count of DedSec."
FIFA 14,XBOX ONE,EA Sports,2013,11,22,1310000,440000,780000,N/A,100000,0,1,1,1,"Sports, Team, Soccer, Sim",N/A,88,58,85,N/A,N/A,N/A,77.5,N/A,80,70,91,N/A,#VALUE!,"FIFA 14 is a sports association football simulation video game developed by EA Canada and published by EA Sports.The game features 33 fully licensed leagues, comprising over 600 clubs with over 16,000 players, as well as 47 fully licensed international teams and a legends team.[12] Included for the first time are three of the top leagues in South America: the Argentine Primera División, the Chilean Primera División and the Colombian Categoría Primera A."
Destiny: The Taken King,XBOX ONE,Activision,2015,9,15,1270000,910000,230000,N/A,120000,0,1,1,0,"Action, Shooter, First-Person, Arcade",N/A,89,53,80,N/A,N/A,N/A,N/A,N/A,N/A,N/A,90,N/A,#VALUE!,"Destiny: The Taken King is a major expansion for Bungie's first-person shooter, Destiny.Players must face the ""Taken"", Oryx's army of corrupted aliens forced to fight for him. The Taken King adds content across the game, including new missions, a Player versus Environment location, Player versus Player maps, player gear, weaponry, and a new raid. Upon the expansion's release, retailers also issued Destiny: The Taken King Legendary Edition which includes Destiny (base game), The Taken King, and the previous two expansions, The Dark Below and House of Wolves."
Battlefield: Hardline,XBOX ONE,Electronic Arts,2015,3,17,1240000,730000,390000,10000,110000,0,1,1,1,"Modern, Action, Shooter, First-Person, Tactical, Arcade",N/A,71,52,65,60,N/A,75,80,80,70,70,80,N/A,#VALUE!,"Battlefield Hardline is a first-person shooter video game developed by Visceral Games and published by Electronic Arts.The focus of the game is the ""war on crime"", breaking away from the military setting that characterized the series. As such, the main factions in Hardline are the police Special Response Units and criminals. Players have access to various military-grade weapons and vehicles, such as the Lenco BearCat, as well as having police equipment such as tasers and handcuffs."
Dark Souls III,XBOX ONE,Namco Bandai Games,2016,4,12,1240000,N/A,N/A,N/A,N/A,0,1,1,1,"Role-Playing, Action RPG",N/A,87,86,90,85,90,N/A,92.5,90,80,90,95,38,95,"Dark Souls III is an action role-playing video game developed by FromSoftware and published by Bandai Namco Entertainment.It is an action role-playing game played in a third-person perspective. Players have access to a variety of weapons, armor, magic, and consumables that they can use to fight their enemies. Bonfires serve as checkpoints. The Estus Flask is the consumable used for healing in Dark Souls III. Ashen Estus Flasks restore focus points (FP), which can be used for magic or weapon arts. "
Sunset Overdrive,XBOX ONE,Microsoft Studios,2014,10,28,1160000,640000,420000,0,100000,0,0,1,1,"General, Action, Shooter, Third-Person, Arcade",80,81,78,85,85,N/A,90,92.5,100,80,80,90,N/A,#VALUE!,"Sunset Overdrive is an action-adventure shooter video game developed by Insomniac Games and published by Microsoft Studios.The game is set in 2027, in a fictional metropolis called Sunset City. The player controls an employee of FizzCo, who has to fight off the OD, short for Overcharge Drinkers: humans who have turned into mutants after drinking FizzCo's energy drink beverage. In the dystopian Sunset City, the player character can wall-run, use zip-lines, and grind rails to swiftly navigate through it, with a large arsenal of weapons to use. The game also has a cooperative multiplayer mode called Chaos Squad, which tasks players to complete a series of missions with seven players."
Middle-Earth: Shadow of War,XBOX ONE,Warner Bros. Interactive Entertainment,2017,10,10,1150000,750000,290000,N/A,110000,0,1,1,1,"Action Adventure, Open-World",N/A,81,42,82,70,N/A,80,95,N/A,70,90,90,N/A,#VALUE!,"Middle-earth: Shadow of War is an action role-playing video game developed by Monolith Productions and published by Warner Bros. Interactive Entertainment. It is the sequel to 2014's Middle-earth: Shadow of Mordor. The player continues the story of the ranger Talion and the spirit of the elf lord Celebrimbor, who shares Talion's body, as they forge a new Ring of Power to amass an army to fight against Sauron. The game builds upon the ""Nemesis System"" introduced in Shadow of Mordor, allowing Talion to gain followers from several races of Middle-earth, including Uruks and Ologs, and plan out complex strategies using these to complete missions."
Lego Marvel Super Heroes,XBOX ONE,Warner Bros. Interactive Entertainment	,2013,11,22,1150000,610000,440000,N/A,100000,0,1,1,1,"Action Adventure, General, Fantasy, Open-World",N/A,71,71,80,85,N/A,N/A,90,N/A,70,N/A,90,N/A,#VALUE!,"Lego Marvel Super Heroes is a Lego-themed action-adventure video game developed by Traveller's Tales and published by Warner Bros. Interactive Entertainment.The game's storyline sees various heroes from the Marvel Universe joining forces to foil the schemes of Doctor Doom and Loki, who have also recruited a number of villains to aid them, and seek to conquer the Earth using the Doom Ray of Doom, a device built from the shards of the Silver Surfer's board called ""Cosmic Bricks"". Lego Marvel Super Heroes received generally positive reviews, and is currently the best-selling Lego video game of all time."
